{
  "id": "com.example.super-todo",
  "version": "0.0.7",
  "name": "SuperTodo",
  "icon": "",
  "permissions": [],
  "ui_extension": {
    "views": [
      {
        "viewport": "stripe.dashboard.customer.detail",
        "component": "CustomerDetailView"
      },
      {
        "viewport": "stripe.dashboard.payment.list",
        "component": "PaymentListView"
      },
      {
        "viewport": "stripe.dashboard.home.overview",
        "component": "HomeOverviewView"
      },
      {
        "viewport": "stripe.dashboard.customer.list",
        "component": "CustomerListView"
      }
    ],
    "actions": [],
    "content_security_policy": {
      "connect-src": null,
      "image-src": null,
      "purpose": ""
    }
  },
  "post_install_action": null
}
